{
  "$schema": "https://open-design.ai/schemas/plugin.v1.json",
  "specVersion": "1.0.0",
  "name": "example-vfx-text-cursor",
  "title": "VFX Text Cursor",
  "version": "0.1.0",
  "description": "Cursor light trail, chromatic rays, and directional flares for word-by-word quote reveals in video intros.",
  "license": "MIT",
  "author": {
    "name": "Open Design",
    "url": "https://github.com/nexu-io"
  },
  "homepage": "https://github.com/nexu-io/open-design/tree/main/plugins/_official/examples/vfx-text-cursor",
  "tags": [
    "example",
    "first-party",
    "video",
    "vfx",
    "text",
    "cursor",
    "chromatic",
    "reveal",
    "frame"
  ],
  "compat": {
    "agentSkills": [
      {
        "path": "./SKILL.md"
      }
    ]
  },
  "od": {
    "kind": "scenario",
    "taskKind": "new-generation",
    "mode": "video",
    "scenario": "video",
    "surface": "video",
    "featured": 0.15,
    "preview": {
      "type": "html",
      "entry": "./example.html"
    },
    "useCase": {
      "query": {
        "en": "Use the VFX Text Cursor template to turn my content into a video-intro quote reveal with cursor light trails, chromatic rays, and directional flares. Preserve the template's visual signature, use real content and data, and avoid lorem ipsum or placeholder images.",
        "zh-CN": "用「VFX 文字光标」模板把我的内容做成一段「光标拖光 + 彩色像散射线 + 定向光斑, 适合视频片头逐字揭示金句」。保持模板的视觉签名，使用真实内容和数据，避免 lorem ipsum 和占位图片。"
      },
      "exampleOutputs": [
        {
          "path": "./example.html",
          "title": "VFX Text Cursor",
          "title_i18n": {
            "en": "VFX Text Cursor",
            "zh-CN": "VFX 文字光标"
          }
        }
      ]
    },
    "context": {
      "skills": [
        {
          "path": "./SKILL.md"
        }
      ],
      "assets": [
        "./example.html"
      ]
    },
    "pipeline": {
      "stages": [
        {
          "id": "generate",
          "atoms": [
            "file-write",
            "live-artifact"
          ]
        }
      ]
    },
    "capabilities": [
      "prompt:inject",
      "fs:write"
    ]
  },
  "title_i18n": {
    "en": "VFX Text Cursor",
    "zh-CN": "VFX 文字光标"
  },
  "description_i18n": {
    "en": "Cursor light trail, chromatic rays, and directional flares for word-by-word quote reveals in video intros.",
    "zh-CN": "光标拖光 + 彩色像散射线 + 定向光斑, 适合视频片头逐字揭示金句"
  }
}
