{
  "$schema": "https://open-design.ai/schemas/plugin.v1.json",
  "specVersion": "1.0.0",
  "name": "example-doc-kami-parchment",
  "title": "Kami Parchment Document",
  "version": "0.1.0",
  "description": "Warm parchment canvas (#f5f4ed), monochrome ink-blue accent (#1B365D), one serif family, and editorial-grade typography.",
  "license": "MIT",
  "author": {
    "name": "Open Design",
    "url": "https://github.com/nexu-io"
  },
  "homepage": "https://github.com/nexu-io/open-design/tree/main/plugins/_official/examples/doc-kami-parchment",
  "tags": [
    "example",
    "first-party",
    "prototype",
    "personal",
    "web",
    "desktop",
    "kami",
    "parchment",
    "serif",
    "editorial",
    "report",
    "letter",
    "one-pager"
  ],
  "compat": {
    "agentSkills": [
      {
        "path": "./SKILL.md"
      }
    ]
  },
  "od": {
    "kind": "scenario",
    "taskKind": "new-generation",
    "mode": "prototype",
    "platform": "desktop",
    "scenario": "personal",
    "surface": "web",
    "featured": 0.04,
    "preview": {
      "type": "html",
      "entry": "./example.html"
    },
    "useCase": {
      "query": {
        "en": "Use the Kami Parchment Document template to turn my content into a warm parchment document with monochrome ink-blue accents, one serif family, and editorial-grade typography. Preserve the template's visual signature, use real content and data, and avoid lorem ipsum or placeholder images.",
        "zh-CN": "用「Kami 羊皮纸文档」模板把我的内容做成一份「暖羊皮纸底 (#f5f4ed) + 墨蓝单色 accent (#1B365D) + 单一衬线字体, 编辑级排印」。保持模板的视觉签名，使用真实内容和数据，避免 lorem ipsum 和占位图片。"
      },
      "exampleOutputs": [
        {
          "path": "./example.html",
          "title": "Kami Parchment Document",
          "title_i18n": {
            "en": "Kami Parchment Document",
            "zh-CN": "Kami 羊皮纸文档"
          }
        }
      ]
    },
    "context": {
      "skills": [
        {
          "path": "./SKILL.md"
        }
      ],
      "assets": [
        "./example.html"
      ]
    },
    "pipeline": {
      "stages": [
        {
          "id": "generate",
          "atoms": [
            "file-write",
            "live-artifact"
          ]
        }
      ]
    },
    "capabilities": [
      "prompt:inject",
      "fs:write"
    ]
  },
  "title_i18n": {
    "en": "Kami Parchment Document",
    "zh-CN": "Kami 羊皮纸文档"
  },
  "description_i18n": {
    "en": "Warm parchment canvas (#f5f4ed), monochrome ink-blue accent (#1B365D), one serif family, and editorial-grade typography.",
    "zh-CN": "暖羊皮纸底 (#f5f4ed) + 墨蓝单色 accent (#1B365D) + 单一衬线字体, 编辑级排印"
  }
}
