{
  "$schema": "https://open-design.ai/schemas/plugin.v1.json",
  "specVersion": "1.0.0",
  "name": "example-deck-open-slide-canvas",
  "title": "Open-Slide 1920 Canvas Deck",
  "version": "0.1.0",
  "description": "Locked 1920x1080 canvas deck with React component-level free composition, not bound to a fixed template.",
  "license": "MIT",
  "author": {
    "name": "Open Design",
    "url": "https://github.com/nexu-io"
  },
  "homepage": "https://github.com/nexu-io/open-design/tree/main/plugins/_official/examples/deck-open-slide-canvas",
  "tags": [
    "example",
    "first-party",
    "deck",
    "design",
    "web",
    "canvas",
    "open-slide",
    "freeform",
    "1920",
    "react"
  ],
  "compat": {
    "agentSkills": [
      {
        "path": "./SKILL.md"
      }
    ]
  },
  "od": {
    "kind": "scenario",
    "taskKind": "new-generation",
    "mode": "deck",
    "scenario": "design",
    "surface": "web",
    "featured": 0.17,
    "preview": {
      "type": "html",
      "entry": "./example.html"
    },
    "useCase": {
      "query": {
        "en": "Use the Open-Slide 1920 Canvas Deck template to turn my content into a locked 1920x1080 free-composition deck with React component-level layout. Preserve the template's visual signature, use real content and data, and avoid lorem ipsum or placeholder images.",
        "zh-CN": "用「1920 画布自由 Deck」模板把我的内容做成一套「锁死 1920×1080 画布, React 组件级自由组合, 不绑模板」。保持模板的视觉签名，使用真实内容和数据，避免 lorem ipsum 和占位图片。"
      },
      "exampleOutputs": [
        {
          "path": "./example.html",
          "title": "Open-Slide 1920 Canvas Deck",
          "title_i18n": {
            "en": "Open-Slide 1920 Canvas Deck",
            "zh-CN": "1920 画布自由 Deck"
          }
        }
      ]
    },
    "context": {
      "skills": [
        {
          "path": "./SKILL.md"
        }
      ],
      "assets": [
        "./example.html"
      ]
    },
    "pipeline": {
      "stages": [
        {
          "id": "generate",
          "atoms": [
            "file-write",
            "live-artifact"
          ]
        }
      ]
    },
    "capabilities": [
      "prompt:inject",
      "fs:write"
    ]
  },
  "title_i18n": {
    "en": "Open-Slide 1920 Canvas Deck",
    "zh-CN": "1920 画布自由 Deck"
  },
  "description_i18n": {
    "en": "Locked 1920x1080 canvas deck with React component-level free composition, not bound to a fixed template.",
    "zh-CN": "锁死 1920×1080 画布, React 组件级自由组合, 不绑模板"
  }
}
