{
  "$schema": "https://open-design.ai/schemas/plugin.v1.json",
  "specVersion": "1.0.0",
  "name": "example-social-reddit-card",
  "title": "Reddit Post Card",
  "version": "0.1.0",
  "description": "Realistic Reddit post card with vote rail and comment count, suited to video overlays or story sharing.",
  "license": "MIT",
  "author": {
    "name": "Open Design",
    "url": "https://github.com/nexu-io"
  },
  "homepage": "https://github.com/nexu-io/open-design/tree/main/plugins/_official/examples/social-reddit-card",
  "tags": [
    "example",
    "first-party",
    "prototype",
    "marketing",
    "web",
    "desktop",
    "reddit",
    "social",
    "card",
    "overlay",
    "story"
  ],
  "compat": {
    "agentSkills": [
      {
        "path": "./SKILL.md"
      }
    ]
  },
  "od": {
    "kind": "scenario",
    "taskKind": "new-generation",
    "mode": "prototype",
    "platform": "desktop",
    "scenario": "marketing",
    "surface": "web",
    "preview": {
      "type": "html",
      "entry": "./example.html"
    },
    "useCase": {
      "query": {
        "en": "Use the Reddit Post Card template to turn my content into a realistic Reddit post card with vote rail and comment count for a video overlay or story share. Preserve the template's visual signature, use real content and data, and avoid lorem ipsum or placeholder images.",
        "zh-CN": "用「Reddit 帖子卡」模板把我的内容做成一份「拟真 Reddit 帖子卡 + 上下投票 + 评论数, 适合视频叠加 / 故事分享」。保持模板的视觉签名，使用真实内容和数据，避免 lorem ipsum 和占位图片。"
      },
      "exampleOutputs": [
        {
          "path": "./example.html",
          "title": "Reddit Post Card",
          "title_i18n": {
            "en": "Reddit Post Card",
            "zh-CN": "Reddit 帖子卡"
          }
        }
      ]
    },
    "context": {
      "skills": [
        {
          "path": "./SKILL.md"
        }
      ],
      "assets": [
        "./example.html"
      ]
    },
    "pipeline": {
      "stages": [
        {
          "id": "generate",
          "atoms": [
            "file-write",
            "live-artifact"
          ]
        }
      ]
    },
    "capabilities": [
      "prompt:inject",
      "fs:write"
    ]
  },
  "title_i18n": {
    "en": "Reddit Post Card",
    "zh-CN": "Reddit 帖子卡"
  },
  "description_i18n": {
    "en": "Realistic Reddit post card with vote rail and comment count, suited to video overlays or story sharing.",
    "zh-CN": "拟真 Reddit 帖子卡 + 上下投票 + 评论数, 适合视频叠加 / 故事分享"
  }
}
