{
  "$schema": "https://open-design.ai/schemas/plugin.v1.json",
  "specVersion": "1.0.0",
  "name": "example-card-twitter",
  "title": "Twitter Share Card",
  "version": "0.1.0",
  "description": "Twitter quote or data card designed to pair with a post.",
  "license": "MIT",
  "author": {
    "name": "Open Design",
    "url": "https://github.com/nexu-io"
  },
  "homepage": "https://github.com/nexu-io/open-design/tree/main/plugins/_official/examples/card-twitter",
  "tags": [
    "example",
    "first-party",
    "prototype",
    "marketing",
    "web",
    "desktop",
    "twitter",
    "x",
    "quote",
    "untitled"
  ],
  "compat": {
    "agentSkills": [
      {
        "path": "./SKILL.md"
      }
    ]
  },
  "od": {
    "kind": "scenario",
    "taskKind": "new-generation",
    "mode": "prototype",
    "platform": "desktop",
    "scenario": "marketing",
    "surface": "web",
    "preview": {
      "type": "html",
      "entry": "./example.html"
    },
    "useCase": {
      "query": {
        "en": "Use the Twitter Share Card template to turn my content into a Twitter quote or data card designed to pair with a post. Preserve the template's visual signature, use real content and data, and avoid lorem ipsum or placeholder images.",
        "zh-CN": "用「Twitter 分享卡」模板把我的内容做成一份「推特金句 / 数据卡, 适合配推文」。保持模板的视觉签名，使用真实内容和数据，避免 lorem ipsum 和占位图片。"
      },
      "exampleOutputs": [
        {
          "path": "./example.html",
          "title": "Twitter Share Card",
          "title_i18n": {
            "en": "Twitter Share Card",
            "zh-CN": "Twitter 分享卡"
          }
        }
      ]
    },
    "context": {
      "skills": [
        {
          "path": "./SKILL.md"
        }
      ],
      "assets": [
        "./example.html"
      ]
    },
    "pipeline": {
      "stages": [
        {
          "id": "generate",
          "atoms": [
            "file-write",
            "live-artifact"
          ]
        }
      ]
    },
    "capabilities": [
      "prompt:inject",
      "fs:write"
    ]
  },
  "title_i18n": {
    "en": "Twitter Share Card",
    "zh-CN": "Twitter 分享卡"
  },
  "description_i18n": {
    "en": "Twitter quote or data card designed to pair with a post.",
    "zh-CN": "推特金句 / 数据卡, 适合配推文"
  }
}
