{
  "$schema": "https://open-design.ai/schemas/plugin.v1.json",
  "specVersion": "1.0.0",
  "name": "example-mockup-device-3d",
  "title": "Device 3D Showcase",
  "version": "0.1.0",
  "description": "Static iPhone and MacBook 3D-style showcase with real HTML embedded on screens, glass-lens refraction, and 360-degree turntable composition.",
  "license": "MIT",
  "author": {
    "name": "Open Design",
    "url": "https://github.com/nexu-io"
  },
  "homepage": "https://github.com/nexu-io/open-design/tree/main/plugins/_official/examples/mockup-device-3d",
  "tags": [
    "example",
    "first-party",
    "prototype",
    "product",
    "web",
    "desktop",
    "device",
    "mockup",
    "iphone",
    "macbook",
    "html-in-canvas"
  ],
  "compat": {
    "agentSkills": [
      {
        "path": "./SKILL.md"
      }
    ]
  },
  "od": {
    "kind": "scenario",
    "taskKind": "new-generation",
    "mode": "prototype",
    "platform": "desktop",
    "scenario": "product",
    "surface": "web",
    "preview": {
      "type": "html",
      "entry": "./example.html"
    },
    "useCase": {
      "query": {
        "en": "Use the Device 3D Showcase template to turn my content into a static iPhone and MacBook 3D-style showcase with real HTML embedded on the screens. Preserve the template's visual signature, use real content and data, and avoid lorem ipsum or placeholder images.",
        "zh-CN": "用「iPhone × MacBook 立体展架」模板把我的内容做成一份「iPhone + MacBook 仿 GLTF 静态展架, 屏幕内嵌真实 HTML 内容, 玻璃镜头折射, 360° 转盘构图」。保持模板的视觉签名，使用真实内容和数据，避免 lorem ipsum 和占位图片。"
      },
      "exampleOutputs": [
        {
          "path": "./example.html",
          "title": "Device 3D Showcase",
          "title_i18n": {
            "en": "Device 3D Showcase",
            "zh-CN": "iPhone × MacBook 立体展架"
          }
        }
      ]
    },
    "context": {
      "skills": [
        {
          "path": "./SKILL.md"
        }
      ],
      "assets": [
        "./example.html"
      ]
    },
    "pipeline": {
      "stages": [
        {
          "id": "generate",
          "atoms": [
            "file-write",
            "live-artifact"
          ]
        }
      ]
    },
    "capabilities": [
      "prompt:inject",
      "fs:write"
    ]
  },
  "title_i18n": {
    "en": "Device 3D Showcase",
    "zh-CN": "iPhone × MacBook 立体展架"
  },
  "description_i18n": {
    "en": "Static iPhone and MacBook 3D-style showcase with real HTML embedded on screens, glass-lens refraction, and 360-degree turntable composition.",
    "zh-CN": "iPhone + MacBook 仿 GLTF 静态展架, 屏幕内嵌真实 HTML 内容, 玻璃镜头折射, 360° 转盘构图"
  }
}
