{
  "$schema": "https://open-design.ai/schemas/plugin.v1.json",
  "specVersion": "1.0.0",
  "name": "example-poster-hero",
  "title": "Marketing Poster",
  "version": "0.1.0",
  "description": "Vertical poster or Moments-style share image with strong visual impact.",
  "license": "MIT",
  "author": {
    "name": "Open Design",
    "url": "https://github.com/nexu-io"
  },
  "homepage": "https://github.com/nexu-io/open-design/tree/main/plugins/_official/examples/poster-hero",
  "tags": [
    "example",
    "first-party",
    "prototype",
    "marketing",
    "web",
    "desktop",
    "poster",
    "untitled"
  ],
  "compat": {
    "agentSkills": [
      {
        "path": "./SKILL.md"
      }
    ]
  },
  "od": {
    "kind": "scenario",
    "taskKind": "new-generation",
    "mode": "prototype",
    "platform": "desktop",
    "scenario": "marketing",
    "surface": "web",
    "preview": {
      "type": "html",
      "entry": "./example.html"
    },
    "useCase": {
      "query": {
        "en": "Use the Marketing Poster template to turn my content into a vertical poster or Moments-style share image with strong visual impact. Preserve the template's visual signature, use real content and data, and avoid lorem ipsum or placeholder images.",
        "zh-CN": "用「营销海报」模板把我的内容做成一份「竖版海报 / 朋友圈分享图, 强视觉冲击」。保持模板的视觉签名，使用真实内容和数据，避免 lorem ipsum 和占位图片。"
      },
      "exampleOutputs": [
        {
          "path": "./example.html",
          "title": "Marketing Poster",
          "title_i18n": {
            "en": "Marketing Poster",
            "zh-CN": "营销海报"
          }
        }
      ]
    },
    "context": {
      "skills": [
        {
          "path": "./SKILL.md"
        }
      ],
      "assets": [
        "./example.html"
      ]
    },
    "pipeline": {
      "stages": [
        {
          "id": "generate",
          "atoms": [
            "file-write",
            "live-artifact"
          ]
        }
      ]
    },
    "capabilities": [
      "prompt:inject",
      "fs:write"
    ]
  },
  "title_i18n": {
    "en": "Marketing Poster",
    "zh-CN": "营销海报"
  },
  "description_i18n": {
    "en": "Vertical poster or Moments-style share image with strong visual impact.",
    "zh-CN": "竖版海报 / 朋友圈分享图, 强视觉冲击"
  }
}
